Exhibit Number,Description,Date,Keywords,File Type,Category,Priority
A-2,Text Admission - I'm really sorry for hitting you,2024-12-09,text sorry hitting admission screenshot,jpg,PERJURY,10
A-3,Cole-Emma-Tony conversation re: December 9 incident,2024-12-09,cole emma tony conversation dec9,png,COMMUNICATION,10
A-4,Emma's December 9 threatening messages,2024-12-09,emma threatening message narrative truth,png,OBSTRUCTION,10
A-5,Emma-Harper assault documentation (December 9 incident),2024-12-09,emma harper assault documentation video,mp4,SAFETY,10
A-6,E-transfer records from Jane Ryan funding methamphetamine,2024-12-09,etransfer jane ryan drug funding,pdf,FINANCIAL,10
A-7,Proof of Access Denial - 129 consecutive days,2025-10-10,access denial 129 days timeline,pdf,OBSTRUCTION,10
A-8,Video - Reunion with Harper after 129-day denial,2025-10-10,reunion video harper father bond,mp4,INTEGRITY,10
A-9,Video - Maternal grandmother leaving infant in vehicle at -22C,2026-01-04,endangerment vehicle cold weather video,mp4,SAFETY,10
A-10,Emma admission text re: meth in breastmilk,2024-12-24,emma admission meth breastmilk,jpg,SAFETY,10
A-11,Photo - Methamphetamine paraphernalia and propane torch in home,2025-05-31,photo meth paraphernalia torch home,jpg,SAFETY,10
A-12,Hostile Emails from Emma Ryan - threats re: 'piss every day',2025-06-18,hostile email emma threats drug accusations,pdf,COMMUNICATION,8
A-13,Email thread re: Father's Day denial and violence admission,2025-06-15,fathers day denial email admission violence,pdf,OBSTRUCTION,10
A-14,iCash Loan Agreement (Source of SIN/Account Numbers),2024-11-01,icash agreement emma sin financial,jpg,FINANCIAL,5
A-15,Emma text admission re: banking card (wallet excuse rebuttal),2025-06-25,emma text drug debt banking card,jpg,INTEGRITY,7
A-1,Police Email - Assault Charge Confirmation,2025-09-26,police email assault charge,pdf,PERJURY,10
A-2,"Admission of Violence Text - ""I'm really sorry for hitting you""",2024-11-21,text sorry hitting admission screenshot,jpg,SAFETY,10
A-3,Video Recording - IMG_0667 involving drugs and knives,Unknown,video drugs knives baby luna,mp4,SAFETY,10
A-4,Formal Complaint PDF regarding Jane Ryan,2025-12-03,formal complaint jane ryan school district,pdf,INTEGRITY,7
A-5,Criminal Disclosure - Saint John Police Force File #25-2390069,Unknown,criminal disclosure police file 252390069,pdf,FINANCIAL,8
A-6,Evidence Integrity Certification - SHA256 hashing,2025-11-06,sha256 hash integrity certification,pdf,INTEGRITY,9
A-5,Evidence of Emma's substance abuse,Unknown,emma substance abuse proof,pdf,SAFETY,9
A-6,Evidence of Emma's substance abuse,Unknown,emma substance abuse proof additional,pdf,SAFETY,9
A-9,Evidence of Emma's contempt of court orders,Unknown,emma contempt court documentation,pdf,OBSTRUCTION,9
A-14,Evidence of Emma's contempt,Unknown,contempt evidence emma,pdf,OBSTRUCTION,9
A-35,Contempt documentation - denial of access,Unknown,access denial contempt 35,pdf,OBSTRUCTION,9
