Exhibit Number,Description,Date,Keywords,File Type,Category,Priority
A-12,Gmail - Fwd: Subject Important Medical Information for Harper Ryan - Prenatal/Postnatal History,2025-06-22,gmail medical information harper ryan prenatal postnatal history,pdf,COMMUNICATION,8
A-13,Video 2025-01-08.MP4,2025-01-08,20250108 mp4,mp4,SAFETY,10
A-14,Emma email June 26th pickup confirmation,2025-06-28,emma email june 26th pickup,png,COMMUNICATION,5
A-15,Emma's reply to Christmas proposal,2025-07-02,emmas reply christmas proposal,html,COMMUNICATION,4
A-16,Emma Nick St Pierre 0524 Photoshop Analysis,2025-06-30,emma nick st pierre 0524 photoshop,pdf,PERJURY,9
A-1,"Police Records - Documentation of domestic abuse, substance abuse, or safety concerns",Unknown,police record arrest domestic abuse safety,pdf,SAFETY,9
A-2,Electronic Breathalyzer Results - Concrete data on alcohol consumption levels,Unknown,bactrack breathalyzer test result sobriety,pdf,INTEGRITY,10
A-3,Employment and School Records - Third-party proof of parental stability and responsibility,Unknown,employment school records stability attendance,pdf,INTEGRITY,8
A-4,Bank Records - patterns of spending related to substance use or financial responsibility,Unknown,bank statement spending patterns substance use,pdf,FINANCIAL,7
A-5,"Medical Records - Documentation of health issues, disabilities, or Substance Use Disorder",Unknown,medical records health diagnosis sud,pdf,SAFETY,9
A-6,Social Media Screenshots - Posts demonstrating disregard of custody terms or disparagement,Unknown,social media screenshot post disparagement,png,COMMUNICATION,6
A-7,"Personal Communications - Texts, emails, or letters relevant to parenting behavior",Unknown,texts emails letters communication behavior,pdf,COMMUNICATION,8
A-8,Social Services Reports - Investigations into child welfare ordered by the court,Unknown,social services report welfare investigation,pdf,SAFETY,10
A-9,Private Investigator Reports - Refutation or confirmation of claims made by the opposing party,Unknown,pi report investigator evidence search,pdf,INTEGRITY,7
A-10,Witness Statements - Testimony from neighbors or third parties regarding daily parenting life,Unknown,witness statement testimony parenting ability,pdf,INTEGRITY,5
A-11,Affidavit of Parental Preference - Expressed wishes of children over 10 or 12 years old,Unknown,child wishes affidavit preference,pdf,INTEGRITY,9
A-12,Evidence of Unilateral Action - Proof of parent moving first and asking permission later,Unknown,unilateral action move relocation evidence,pdf,OBSTRUCTION,7
A-1,Court Ruling - Re Hardy (1979) - Opinion on third bankruptcy being excessive,1979-01-01,re hardy court ruling bankruptcy integrity,pdf,INTEGRITY,7
A-2,Court Ruling - Re Resnick (1990) - Observation on cycle of repeat bankruptcies,1990-01-01,re resnick court ruling repeat bankruptcy,pdf,INTEGRITY,6
A-3,Court Case - Rogers (Trustee of) v. Canada (AG) - Refusal of fifth discharge due to tax arrears pattern,1989-01-01,rogers trustee canada ag fifth bankruptcy tax,pdf,FINANCIAL,9
A-4,OSB Statistical Report BKHQRA-2157 - Breakdown of repeat bankruptcies (2010-2012),2013-03-28,osb report bkhqra2157 repeat bankruptcy statistics,pdf,FINANCIAL,5
A-5,Court Ruling - Re Pitre (2009) - Priority of system integrity over rehabilitation,2009-01-01,re pitre court ruling integrity vs rehabilitation,pdf,INTEGRITY,8
A-6,Court Ruling - Re Willier (2005) - Test for concept of debtor recidivism,2005-01-01,re willier court ruling debtor recidivism,pdf,INTEGRITY,7
A-7,Court Ruling - Bank of Montreal v. Giannotti - Definitions of rehabilitation for honest debtors,2000-01-01,bank of montreal v giannotti court case,pdf,INTEGRITY,6
A-8,Court Ruling - Re Tang (2007) - Refusal of second discharge due to reckless behavior,2007-01-01,re tang court ruling reckless bankruptcy,pdf,INTEGRITY,8
A-9,Court Ruling - Re Martens (1994) - Critique of the BIA used as a 'convenient ink remover' for taxes,1994-01-01,re martens tax driven bankruptcy ruling,pdf,FINANCIAL,7
A-10,Evaluation of Mandatory Counselling Report - Audit and Evaluation Branch (2013),2013-01-01,aeb report mandatory counselling evaluation 2013,pdf,COMMUNICATION,4
A-11,Court Ruling - Re Garness (2004) - Comparison of bankrupt to 'SARS-like presence',2004-01-01,re garness economic quarantine ruling,pdf,INTEGRITY,8
A-12,Court Ruling - Re Hiebert (2008) - Denial of fourth discharge for lack of insight,2008-01-01,re hiebert fourth bankruptcy discharge denial,pdf,INTEGRITY,9
A-1,Evidence of child freezing incident involving failure to provide heat or protection from elements,2025-01-04,january 4 freezing child neglect incident,pdf,SAFETY,10
A-2,Late-filed affidavit regarding child endangerment,Unknown,late affidavit child safety NBKB,pdf,SAFETY,8
A-3,Campaign of denigration fueled by false allegations of abuse,Unknown,doncaster field campaign denigration allegations,pdf,PERJURY,9
A-4,Documented patterns of intimate terrorism and systemic control,2023-01-01,nova scotia mass casualty commission IT pattern,pdf,SAFETY,9
A-5,Evidence of grandmother serving as a 'Shadow Applicant' orchestrating alienation,Unknown,simmons grandmother shadow applicant gatekeeping,pdf,OBSTRUCTION,7
A-6,Fabricated reports of child abuse used for tactical litigation advantage,Unknown,fabricated abuse report litigation harassment,pdf,PERJURY,10
A-1,Text message from December 8th saying 'leave it in the mailbox so Craig doesn't flip out',Unknown-12-08,text message mailbox craig flip out,png,COMMUNICATION,7
A-2,Bank/Money transfer record from mother to Emma and subsequently to an alleged drug dealer,Unknown-12-08,money transfer record drug dealer emma,pdf,FINANCIAL,9
A-3,Video showing Emma 'flipping out' and hitting the victim while the baby was in their arms,Unknown-12-08,video assault flipping out baby arms,mp4,SAFETY,10
A-4,Official Assault Charge record for incident occurring on December 8th,Unknown-12-08,assault charge record december 8,pdf,SAFETY,10
A-5,Apology text received two weeks prior where Emma admits to hitting the victim,Unknown,text apology hitting admission hitting emma,png,SAFETY,10
A-1,Photograph of black eye injury sustained by Craig Schulz during a physical assault by Emma Ryan,2024-11-19,black eye photo assault injury,jpg,SAFETY,10
A-2,iMessage/Text Admission from Emma Ryan apologizing for hitting Craig Schulz and admitting loss of control,2024-11-21,text admission sorry hitting apology,jpg,PERJURY,10
A-3,Video footage of Emma Ryan shattering a mirror in a state of rage and swinging at Craig Schulz,2024-11-30,video mirror shatter rage assault,mp4,SAFETY,9
A-4,Photographs of Harper Ryan's severe diaper rash and subsequent healing under Craig's care,2024-11-17,photo diaper rash health healing,jpg,INTEGRITY,7
A-5,NICU records and personal logs of Harper's weight and developmental milestones tracked by Craig Schulz,2024-11-12,nicu weight logs milestones hospital,pdf,INTEGRITY,6
A-6,Text message log from Dec 9 showing Emma Ryan giving Craig one hour to leave the home,2024-12-09,text ultimatum leave house 250pm,jpg,COMMUNICATION,8
A-7,Police call logs and communication records regarding daily wellness checks for Harper Ryan,2024-12-10,police wellness checks call log,pdf,OBSTRUCTION,8
A-8,Medical report from Saint John Regional Hospital regarding Harper's blood tests (jaundice),2024-11-12,blood report jaundice hospital labs,pdf,SAFETY,7
A-9,Communication records showing Emma Ryan admitting to locking herself out of accounts/numerical difficulties,2024-05-01,text laptop erase pin error,jpg,INTEGRITY,5
A-10,Text exchange where Emma Ryan requests drug dealer 'T' (Tony Baker) while Craig is out,2025-05-06,text drug purchase tony baker stuff,jpg,SAFETY,10
A-11,Email from Emma Ryan stating she will withhold access to Harper until a judge is seen in October,2025-06-18,email denial access access judge october,pdf,OBSTRUCTION,9
A-12,Video evidence depicting Emma Ryan with a torch and methamphetamine pipe,2025-05-20,video meth pipe torch drug use,mp4,SAFETY,10
A-13,Text message from Emma Ryan using 'Hugh' (high) as a direct request for substance use,2025-05-15,text get hugh high drugs,jpg,SAFETY,9
A-14,Baby monitor audio recording of Emma Ryan screaming 'Get off!' during sexual intercourse,2025-01-15,audio monitor get off intercourse,mp3,INTEGRITY,9
A-15,Bank Statement entries showing e-transfers to Tony Baker (identified drug dealer),2024-08-01,bank statement etransfer tony baker,pdf,FINANCIAL,10
A-16,Urgent Motion for Emergency Interim Custody and Form 72J Financial Affidavit,2025-07-01,urgent motion custody financial affidavit,pdf,FINANCIAL,8
A-17,Video summary/thumbnail of Nov 19 altercation where Emma Ryan throws objects while Craig holds Harper,2024-11-19,video thumbnail assault holding harper,jpg,SAFETY,10
A-18,Video summary/thumbnail of Dec 9 incident showing Emma Ryan choking Craig Schulz,2024-12-09,video thumbnail choking self defense,jpg,SAFETY,10
A-1,"Photograph of Black Eye (Craig Schulz, ~Nov 2024) showing Violence/Abuse Pattern",2024-11-01,photograph black eye violence abuse pattern,jpg,SAFETY,10
A-2,"Text Messages - Emma: ""Beat the shit out of me"" and ""I'm really sorry for hitting you Craig...""",Unknown,text messages admission violence hitting sorry,png,PERJURY,10
A-3,Email Thread - Threats & Intimidation documenting DARVO Strategy Evidence,Unknown,email thread threats intimidation darvo strategy,pdf,COMMUNICATION,8
A-4,Medical Records - Emergency Room Visit (Nov 2024) and Video summaries of assault,2024-11-01,medical records emergency room injury documentation,pdf,SAFETY,9
A-5,Police Report #2024-XXXX - Domestic Assault including Formal Charging Confirmation,2024-12-09,police report domestic assault charging confirmation,pdf,SAFETY,10
A-6,"Screenshot - Emma: ""Methamphetamine Use"" Admission related to Child Safety",Unknown,screenshot methamphetamine use admission substance abuse,png,SAFETY,10
A-14,Screenshots - 19 Denied Sunday Visits documenting Parental Alienation/Contempt,2024-08-18,screenshots denied visits parental alienation contempt,png,OBSTRUCTION,9
A-22,Evidence of financial diversion for substance transactions and supervisor concerns,Unknown,financial records substance transactions diversion,pdf,FINANCIAL,8
A-24,"Text: Emma to Craig: ""I'm done... you do what you want"" - Maternal Abdication",Unknown,text message maternal abdication done,png,INTEGRITY,7
L-1,"Master Video Exhibit Log documenting assault, neglect, and parental bond",2024-12-09,video log img0669 assault child endangerment,mp4,SAFETY,10
A-1,Photo of severe diaper rash developed under mother's care,2024-11-17,photo harper diaper rash,jpg,SAFETY,8
A-2,Video of infant Harper responding to father's voice,2024-12-05,video harper responding sounds,mp4,INTEGRITY,5
A-3,Photo of child's first smile during playtime with father,2024-12-20,photo harper smiling mobile,jpg,INTEGRITY,4
A-4,Legal custody documents served to father by Emma's father,2024-12-27,pdf custody papers served,pdf,PERJURY,10
A-5,Medical record confirming infant's weight and health progress,2024-12-17,medical record weight checkup,pdf,INTEGRITY,7
A-6,Text message evidence of Emma's drug transactions with Tony Baker,Unknown,screenshot drug transactions emma,png,SAFETY,10
A-7,Police incident record - escorting Craig following conflict,2024-08-05,police report august incident,pdf,SAFETY,9
A-8,Police record - conflict mediation where Craig was advised to walk,2024-09-10,police log september conflict,pdf,SAFETY,7
A-9,Photo of Craig's black eye caused by Emma punching him,2024-11-19,photo black eye domestic violence,jpg,SAFETY,9
A-10,Handwritten statement by Emma alleging Craig is abusive/narcissistic,Unknown,handwritten affidavit emma allegations,jpg,PERJURY,10
A-11,Notice of First Court Appearance with incorrect year (January 2024),2024-12-17,notice court appearance wrong date,jpg,PERJURY,10
A-1,Police Record - Assault Charge regarding incident where father punched son,2012-01-01,police assault charge father son rcmp,pdf,SAFETY,10
A-2,Psychological Assessment of Father (ADHD and Asperger’s diagnosis),2012-03-01,psychological assessment adhd aspergers father,pdf,SAFETY,9
A-3,Court-to-Court Judicial Communication Protocol - Appendix A in Giesbrecht,2013-01-01,judicial communication protocol giesbrecht appendix,pdf,COMMUNICATION,5
A-4,T1 General Form - Father's Undisclosed Capital Gain Records,2005-12-31,t1 general capital gain stock options tax,pdf,FINANCIAL,8
A-5,Employee Stock Option Exercise Records ($1.38M Gain),2005-01-01,stock option exercise capital gain mcneil,pdf,FINANCIAL,7
A-6,Psychologist Court-Ordered Report (Mental Health Opinion),2013-01-01,psychologist report mental health expert opinion,pdf,INTEGRITY,8
A-7,Home Study Report - Clinical Social Worker (Children's Preferences),2012-01-01,home study social worker relocation wishes,pdf,COMMUNICATION,6
A-8,Tax-Free Living Allowance Receipts (Fort McMurray),2014-01-01,living allowance receipts fort mcmurray calver,jpg,FINANCIAL,4
A-9,Father's Lifestyle Evidence - Tropical Vacation and Orthodontic Receipts,2014-01-01,lifestyle expenditures vacation orthodontic receipts,pdf,INTEGRITY,7
A-10,Policy 713 - Sexual Orientation and Gender Identity (Revised),2023-06-08,policy 713 gender identity education nb,pdf,INTEGRITY,9
A-1,Police Email - Assault Charge Confirmation,2025-09-26,police email assault charge,pdf,PERJURY,10
A-2,Text message from Emma Ryan admitting to hitting Craig Schulz,2024-11-21,text sorry hitting admission screenshot,jpg,PERJURY,10
A-3,Police Email - Verification of Criminal Assault Charge Against Emma Ryan,2025-09-25,police email assault charge confirmation,pdf,SAFETY,10
A-4,Photograph documenting severe diaper rash neglected in Emma's care and its healing,Unknown,photo diaper rash healing documentation,jpg,SAFETY,8
A-7,Communications related to Emma's delay in retrieving Harper after the Dec 9 incident,2024-12-09,december communication retrieval delay,pdf,COMMUNICATION,7
A-8,Selfie with courthouse clock/locked door showing sheriff closed five minutes early,2025-11-07,selfie courthouse clock locked door obstruction,jpg,OBSTRUCTION,8
A-10,Screenshot of 'Two Roofs One Home' co-parenting application concept,Unknown,two roofs one home app screenshot,png,COMMUNICATION,5
A-18,"Video summary of December 9, 2024 assault by Emma Ryan",2024-12-09,video summary assault emma,mp4,SAFETY,10
A-19,Craig Schulz's driving history and conviction record,Unknown,craig schulz driving history conviction record,pdf,INTEGRITY,6
A-20,Documentation related to Craig Schulz's past gambling and business failure,2021-01-01,gambling business failure documentation,pdf,INTEGRITY,5
A-21,Affidavit from local gas station owner Mentorship/Character Reference,Unknown,character reference affidavit gas station owner,pdf,INTEGRITY,6
A-22,Financial screenshots showing e-transfers to known drug dealer Tony Baker,Unknown,etransfer screenshots drug dealer tony baker,jpg,FINANCIAL,10
A-87,Affidavit of Dale Campbell stating commitment as backup guardian,2025-11-07,dale campbell affidavit backup guardian,pdf,FINANCIAL,9
A-1,Police Email - Confirmation of Emma Ryan's arrest by RCMP in relation to domestic assault (File 25-2390069).,2025-09-26,police email emma ryan arrest domestic assault,pdf,SAFETY,10
A-2,"Text message screenshot - Emma Ryan admitting to hitting Craig Schulz: ""I'm really sorry for hitting you Craig.""",2024-11-22,text sorry hitting emma craig admission,jpg,PERJURY,10
A-3,Medical Review Officer's Report - Craig Schulz comprehensive drug test reporting negative results for all substances.,2025-01-30,craig schulz negative drug test mro,pdf,INTEGRITY,9
A-4,Photograph - Severe diaper rash on Harper Ryan discovered on the night of emergency removal.,2024-12-09,harper diaper rash neglect medical,jpg,SAFETY,10
A-5,Text message screenshot - Emma Ryan admitting to methamphetamine exposure to Harper via breastmilk.,2024-11-30,meth breastmilk admission emma harper,jpg,SAFETY,10
A-6,Photograph - Emma Ryan holding and cleaning a methamphetamine pipe.,2025-05-22,emma meth pipe cleaning active drug use,jpg,SAFETY,10
A-7,"Medical Review Officer's Report - Emma Ryan drug test flagged as ""Negative Dilute.""",2025-01-06,emma ryan negative dilute drug test,pdf,INTEGRITY,8
A-8,"Facebook Messenger Log - Jane Ryan stating ""if you want to see the baby you can take me to court,"" refusing access.",2025-10-19,jane ryan contempt take me to court access denial,pdf,OBSTRUCTION,9
A-9,Financial Records - PLATINUM ROOFING INC. e-Transfer deposits to Emma Ryan totaling thousands of dollars.,2024-07-01,platinum roofing deposits emma ryan support,jpg,FINANCIAL,7
A-10,Text message log - Social Worker Jacklyn denying conflict of interest despite Facebook friendship with Emma's brother.,2024-09-01,jacklyn social worker conflict interest disclosure,jpg,INTEGRITY,9
A-11,"Facebook Messenger Log - Emma Elizabeth stating she will ""never ever take her from you.""",2024-11-20,emma never take baby from you text,jpg,COMMUNICATION,6
A-12,Photograph - Mirror in apartment showing meticulous health and diaper logs created by Craig Schulz.,2024-11-17,mirror health log harper meticulous care,jpg,INTEGRITY,7
A-1,"Police Confirmation of Arrest (Sept 26, 2025). Documents official police record of arrest related to domestic assault charge.",2025-09-26,police arrest confirmation assault,pdf,SAFETY,10
A-2,"Text Admission of Violence (Dec 27, 2024). Text message where applicant admits to physical or verbal violence.",2024-12-27,text admission violence screenshot,jpg,PERJURY,10
A-3,"Admission of Meth Use During Pregnancy (Dec 10, 2024). Text confirmation of drug use while pregnant.",2024-12-10,meth use pregnancy admission text,jpg,SAFETY,8
A-4,"Photograph of Severe Diaper Rash (Dec 9, 2024). Shows physical signs of medical neglect.",2024-12-09,diaper rash neglect photo,jpg,SAFETY,9
A-5,"Medical Report - Drug Test: Negative Dilute (Jan 6, 2025). Indicates a likely attempted drug test evasion.",2025-01-06,drug test negative dilute report,pdf,INTEGRITY,8
A-6,"Photograph of Meth Pipe & Propane Torch (May 22, 2025). Shows active drug paraphernalia in child's environment.",2025-05-22,meth pipe torch drug photo,jpg,SAFETY,9
A-7,"Interim Parenting Order (Oct 6, 2025). Official court order detailing parenting access and supervisor roles.",2025-10-06,interim parenting order maude,pdf,COMMUNICATION,7
A-8,"Email: Access Denial (June 18, 2025). Email from applicant explicitly denying court-ordered access.",2025-06-18,email access denial obstruction,pdf,OBSTRUCTION,10
A-9,"Jane Ryan Contempt Admission (Oct 22, 2025). Audio/Transcript admission of role in access denial.",2025-10-22,jane ryan contempt admission,pdf,OBSTRUCTION,10
A-10,E-Transfers to Drug Supplier (Multiple). Financial records showing payments for illegal substances.,Unknown,etransfer drug supplier payment,pdf,FINANCIAL,8
A-11,"Admission of Meth in Breastmilk (Nov 30, 2024). Text admission of drug use while nursing Harper.",2024-11-30,meth breastmilk admission text,jpg,SAFETY,10
A-13,"Contradicting Kidnapping Claim (Dec 9, 2024). Evidence disproving applicant's false kidnapping narrative.",2024-12-09,kidnapping claim contradiction text,jpg,PERJURY,8
A-14,"Medical Records Request (Feb 13, 2025). Proactive request for child's health history by respondent.",2025-02-13,medical records request harper,pdf,INTEGRITY,5
A-16,"Health Tracking Log Photo (Nov 17, 2024). Record of newborn health maintenance by respondent.",2024-11-17,health tracking log newborn,jpg,INTEGRITY,5
A-17,Character Reference - Ex-Partner (Jan 2025). Statement confirming respondent's stable long-term history.,2025-01-01,character reference ex partner,jpg,INTEGRITY,8
A-22,Contempt Log - 18 Denied Sundays (129+ Days). Detailed record of all access violations.,Unknown,contempt log 129 days denial,pdf,OBSTRUCTION,10
A-56,"Respondent's Drug Test: Clean/Negative (Jan 30, 2025). Negative result for all controlled substances.",2025-01-30,respondent negative drug test,pdf,INTEGRITY,8
A-76,"Respondent's Injury Photographs (Dec 10, 2024). Photos of physical injuries sustained by respondent during domestic incident.",2024-12-10,respondent injury photo assault,jpg,SAFETY,10
A-79,FaceTime with Unknown Male (Apr 2025). Interaction involving child and unidentified associate of applicant.,2025-04-01,facetime unknown male video,jpg,SAFETY,7
A-84,"Integrity Certification (Nov 5, 2025). Professional certification of file hash and authenticity.",2025-11-05,evidence integrity certification,pdf,INTEGRITY,10
A-1,Police Confirmation of Arrest - Email from Constable Benjamin Cannon confirming Emma Ryan's arrest for domestic assault,2025-09-26,police email assault charge,pdf,SAFETY,10
A-2,Text message from Emma Ryan admitting to hitting Craig Schulz,2024-11-21,text apology hitting admission screenshot,jpg,PERJURY,10
A-3,Admission of Methamphetamine use during pregnancy and postpartum in text exchange,2024-12-10,text meth pregnancy admission screenshot,jpg,SAFETY,10
A-4,Photograph of severe diaper rash on Harper Ryan while in Applicant's care,2024-12-09,photo diaper rash neglect,jpg,SAFETY,8
A-5,Applicant's drug test result reported as 'Negative - Dilute',2025-01-06,drug test negative dilute report,pdf,INTEGRITY,7
A-6,Photograph of Applicant handling a meth pipe and propane torch in the home,2025-05-22,photo meth pipe torch endangerment,jpg,SAFETY,10
A-8,Email from Applicant declaring intent to block parenting time until October court date,2025-06-18,email access denial intent,pdf,OBSTRUCTION,9
A-9,Call recording transcript where Jane Ryan refuses a court-ordered exchange,2025-10-22,transcript jane ryan contempt call,pdf,OBSTRUCTION,9
A-10,Bank record screenshots showing E-transfers to an alleged drug supplier,2024-08-01,etransfer bank supplier drug screenshot,png,FINANCIAL,8
A-11,Text admission regarding 'meth in breastmilk' for 5 days or more,2024-11-30,text meth breastmilk exposure admission,jpg,SAFETY,10
A-12,Signed Parenting Agreement through Custody Xchange,2025-01-22,parenting agreement signed january,pdf,COMMUNICATION,6
A-22,Contempt Log documenting 18 denied Sundays and 129 consecutive days of isolation,2025-10-09,contempt log denied access isolation,pdf,OBSTRUCTION,10
A-56,Respondent's (Craig Schulz) Negative Drug Test Result,2025-01-30,craig drug test negative report,pdf,INTEGRITY,8
B-1,Affidavit of Unconditional Financial Commitment from Respondent's Uncle,2025-11-14,affidavit financial support uncle dale,pdf,FINANCIAL,7
L-1,Master Video Log Index of irrefutable visual evidence of violence and drug use,2025-11-10,master video log evidence mp4,mp4,SAFETY,10
A-1,Police Record - Assault Charge Confirmation,2025-09-26,police email assault charge,pdf,PERJURY,10
A-2,Text Message Admission - Violence Statement,2024-11-21,text sorry hitting admission screenshot,jpg,PERJURY,10
A-3,Judicial Decision - Re Drake and Minister for Immigration and Ethnic Affairs No 2,1979-01-01,drake minister immigration ethnic affairs,pdf,INTEGRITY,6
A-4,High Court Decision - Attorney-General (NSW) v Quin,1990-01-01,nsw quin attorney general,pdf,INTEGRITY,7
A-5,High Court Decision - Dietrich v The Queen,1992-01-01,dietrich queen stay representation,pdf,SAFETY,9
A-6,UK Supreme Court Decision - R (Begum) v Special Immigration Appeals Commission,2021-01-01,begum immigration appeals commission,pdf,OBSTRUCTION,8
A-7,Australian Legal Services Directions 2017,2017-01-01,legal services directions model litigant,pdf,COMMUNICATION,5
A-8,Child Welfare Report - Suspected Abuse Case,Unknown,child abuse report sdds,pdf,SAFETY,10
A-9,Financial Statement - Joint Family Venture Assets,Unknown,financial statement joint family venture assets,pdf,FINANCIAL,7
A-1,"Photograph of black eye sustained November 19, 2024, following alleged assault by Applicant.",2024-11-19,black eye photo assault injury,jpg,SAFETY,10
A-2,"Text message admission from Emma Ryan: ""I'm really sorry for hitting you Craig...""",2024-11-21,text sorry hitting admission screenshot,jpg,PERJURY,10
A-3,Email thread documenting threats and intimidation by Applicant.,Unknown,email threats intimidation darvo,pdf,COMMUNICATION,7
A-4,Medical Records - Emergency Room Visit (Nov 2024) documenting injuries to Respondent.,2024-11-01,medical records er visit injuries,pdf,SAFETY,9
A-5,Police Report regarding Domestic Assault incident.,2024-01-01,police report domestic assault corroboration,pdf,SAFETY,9
A-6,"Screenshot of Emma Ryan admitting to ""Methamphetamine Use"".",Unknown,screenshot meth use admission,jpg,SAFETY,10
A-7,Financial Records showing Rent Non-Payment by Applicant.,2024-08-01,financial records rent nonpayment,pdf,FINANCIAL,5
A-8,"Text message from Applicant stating ""I'm not getting anything nutritious..."" regarding child's care.",Unknown,text neglect nutritious food,jpg,SAFETY,8
A-9,Communication from Supervisor regarding concerns about placement/fitness.,Unknown,supervisor email placement concerns,pdf,INTEGRITY,8
A-14,Detailed Contempt Log and Screenshots documenting 19 Denied Sunday Visits.,2024-08-18,contempt log denied visits screenshots,pdf,OBSTRUCTION,10
A-15,Employment Record confirming Craig Schulz's stable roofing job.,Unknown,employment record job stability,pdf,FINANCIAL,6
A-22,Bank account screenshots showing e-transfers to alleged drug supplier.,Unknown,bank screenshots etransfer drug supplier,jpg,FINANCIAL,10
A-34,Screenshot of group chat discussing substance use concerns by Applicant.,Unknown,group chat substance use pattern,jpg,SAFETY,8
A-66,Affidavit from family member serving as a relative character reference.,Unknown,affidavit character reference family,pdf,INTEGRITY,5
A-84,Video Footage: Harper discussing comfort and bond with Craig.,Unknown,video harper comfort dada,mp4,COMMUNICATION,9
A-87,Video Footage: Expert Commentary providing Best Interest Analysis.,Unknown,video expert commentary analysis,mp4,INTEGRITY,7
