Exhibit Number,Description,Date,Category,Priority,File Type,Keywords,Legal Significance,Status,Source
A-2,Bank/Money transfer record from mother to Emma and subsequently to an alleged drug dealer,Unknown-12-08,FINANCIAL,9,pdf,money transfer record drug dealer emma,Demonstrates lifestyle instability and inability to provide a safe/drug-free environment for the child under Section 50(2)(e).,Original,23
A-3,Video showing Emma 'flipping out' and hitting the victim while the baby was in their arms,Unknown-12-08,SAFETY,10,mp4,video assault flipping out baby arms,Visual confirmation of severe family violence putting the child at direct risk; grounds for Contempt of Court.,Original,23
A-4,Official Assault Charge record for incident occurring on December 8th,Unknown-12-08,SAFETY,10,pdf,assault charge record december 8,Objective legal confirmation of family violence; prioritizes child's safety and limits parenting time under Section 50(2)(f).,Original - Government Record,23
A-5,Apology text received two weeks prior where Emma admits to hitting the victim,Unknown,SAFETY,10,png,text apology hitting admission hitting emma,Establishes a historical pattern of physical violence and reinforces 'history of family violence' factor.,Screenshot,23
A-1,Photograph of black eye injury sustained by Craig Schulz during a physical assault by Emma Ryan,2024-11-19,SAFETY,10,jpg,black eye photo assault injury,Direct evidence of physical violence perpetrated by the Applicant against the Respondent.,Original,24
A-2,iMessage/Text Admission from Emma Ryan apologizing for hitting Craig Schulz and admitting loss of control,2024-11-21,PERJURY,10,jpg,text admission sorry hitting apology,Admission against interest; proves Applicant's propensity for violence and contradicts claims of being the sole victim.,Screenshot,24
A-3,Video footage of Emma Ryan shattering a mirror in a state of rage and swinging at Craig Schulz,2024-11-30,SAFETY,9,mp4,video mirror shatter rage assault,Demonstrates a pattern of aggressive behavior and property destruction in the family home.,Original - Video,24
A-4,Photographs of Harper Ryan's severe diaper rash and subsequent healing under Craig's care,2024-11-17,INTEGRITY,7,jpg,photo diaper rash health healing,Supports Respondent's claim of superior parental care and Applicant's neglect of infant's hygiene.,Original,24
A-5,NICU records and personal logs of Harper's weight and developmental milestones tracked by Craig Schulz,2024-11-12,INTEGRITY,6,pdf,nicu weight logs milestones hospital,Evidence of Respondent's consistent involvement and proactive parenting since birth.,Copy - Medical Record,24
A-6,Text message log from Dec 9 showing Emma Ryan giving Craig one hour to leave the home,2024-12-09,COMMUNICATION,8,jpg,text ultimatum leave house 250pm,Contradicts claims of kidnapping; proves Applicant initiated the separation and abandoned the infant for hours.,Screenshot,24
A-7,Police call logs and communication records regarding daily wellness checks for Harper Ryan,2024-12-10,OBSTRUCTION,8,pdf,police wellness checks call log,Proves Applicant was updated on well-being and used police as a tool for harassment.,Copy - Police Record,24
A-8,Medical report from Saint John Regional Hospital regarding Harper's blood tests (jaundice),2024-11-12,SAFETY,7,pdf,blood report jaundice hospital labs,Critical for assessing potential prenatal substance exposure impact on infant health.,Copy,24
A-9,Communication records showing Emma Ryan admitting to locking herself out of accounts/numerical difficulties,2024-05-01,INTEGRITY,5,jpg,text laptop erase pin error,Rebuts claims of 'phone control' and suggests Applicant's own actions caused data loss.,Screenshot,24
A-10,Text exchange where Emma Ryan requests drug dealer 'T' (Tony Baker) while Craig is out,2025-05-06,SAFETY,10,jpg,text drug purchase tony baker stuff,Direct evidence of ongoing substance abuse and connection to dangerous individuals.,Screenshot,24
A-11,Email from Emma Ryan stating she will withhold access to Harper until a judge is seen in October,2025-06-18,OBSTRUCTION,9,pdf,email denial access access judge october,Evidence of unilateral and unjustified denial of parenting time in breach of court standards.,Copy - Email,24
A-12,Video evidence depicting Emma Ryan with a torch and methamphetamine pipe,2025-05-20,SAFETY,10,mp4,video meth pipe torch drug use,Smoking gun evidence of active illicit drug use in a domestic setting where an infant resides.,Original - Video,24
A-13,Text message from Emma Ryan using 'Hugh' (high) as a direct request for substance use,2025-05-15,SAFETY,9,jpg,text get hugh high drugs,Written admission of craving substances while caring for the child.,Screenshot,24
A-14,Baby monitor audio recording of Emma Ryan screaming 'Get off!' during sexual intercourse,2025-01-15,INTEGRITY,9,mp3,audio monitor get off intercourse,Evidence of a potentially staged encounter intended to support false sexual abuse allegations.,Original - Audio,24
A-15,Bank Statement entries showing e-transfers to Tony Baker (identified drug dealer),2024-08-01,FINANCIAL,10,pdf,bank statement etransfer tony baker,Proves financial diversion of child tax/support funds toward illicit drug purchases.,Copy - Bank Record,24
A-16,Urgent Motion for Emergency Interim Custody and Form 72J Financial Affidavit,2025-07-01,FINANCIAL,8,pdf,urgent motion custody financial affidavit,Formal legal filing seeking court intervention based on immediate safety risks to the child.,Copy - Court Filing,24
A-17,Video summary/thumbnail of Nov 19 altercation where Emma Ryan throws objects while Craig holds Harper,2024-11-19,SAFETY,10,jpg,video thumbnail assault holding harper,Corroborates the assault charge and demonstrates reckless endangerment of the infant child.,Screenshot of Video,24
A-18,Video summary/thumbnail of Dec 9 incident showing Emma Ryan choking Craig Schulz,2024-12-09,SAFETY,10,jpg,video thumbnail choking self defense,Primary evidence supporting Respondent's claim of self-defense against life-threatening aggression.,Screenshot of Video,24
A-1,"Photograph of Black Eye (Craig Schulz, ~Nov 2024) showing Violence/Abuse Pattern",2024-11-01,SAFETY,10,jpg,photograph black eye violence abuse pattern,Direct physical evidence of domestic violence and battery against the Respondent,Original,25
A-2,"Text Messages - Emma: ""Beat the shit out of me"" and ""I'm really sorry for hitting you Craig...""",Unknown,PERJURY,10,png,text messages admission violence hitting sorry,Direct evidence of the Applicant’s admission of physical violence; impeaches credibility,Original - Screenshot,25
A-3,Email Thread - Threats & Intimidation documenting DARVO Strategy Evidence,Unknown,COMMUNICATION,8,pdf,email thread threats intimidation darvo strategy,Proves a pattern of harassment and coercive control through digital communication,Copy,25
A-4,Medical Records - Emergency Room Visit (Nov 2024) and Video summaries of assault,2024-11-01,SAFETY,9,pdf,medical records emergency room injury documentation,Third-party medical corroboration of physical injuries sustained from assault,Original - Medical Record,25
A-5,Police Report #2024-XXXX - Domestic Assault including Formal Charging Confirmation,2024-12-09,SAFETY,10,pdf,police report domestic assault charging confirmation,Government record confirming criminal charges for assault against the Applicant,Original - Government Record,25
A-6,"Screenshot - Emma: ""Methamphetamine Use"" Admission related to Child Safety",Unknown,SAFETY,10,png,screenshot methamphetamine use admission substance abuse,"Admits to illegal drug use, posing a high safety risk to the minor child",Original - Screenshot,25
A-14,Screenshots - 19 Denied Sunday Visits documenting Parental Alienation/Contempt,2024-08-18,OBSTRUCTION,9,png,screenshots denied visits parental alienation contempt,Demonstrates a willful pattern of violating court-ordered parenting time,Original - Screenshot,25
A-22,Evidence of financial diversion for substance transactions and supervisor concerns,Unknown,FINANCIAL,8,pdf,financial records substance transactions diversion,Connects financial mismanagement to drug endangerment and parental unfitness,Copy,25
A-24,"Text: Emma to Craig: ""I'm done... you do what you want"" - Maternal Abdication",Unknown,INTEGRITY,7,png,text message maternal abdication done,Shows a voluntary relinquishment of parental responsibility,Original - Screenshot,25
L-1,"Master Video Exhibit Log documenting assault, neglect, and parental bond",2024-12-09,SAFETY,10,mp4,video log img0669 assault child endangerment,Contains visual proof of Applicant striking the child and committing perjury,Original - Digital Media,25
A-1,Photo of severe diaper rash developed under mother's care,2024-11-17,SAFETY,8,jpg,photo harper diaper rash,Evidence of child neglect or inadequate hygiene standards by mother,Original - Photo,26
A-2,Video of infant Harper responding to father's voice,2024-12-05,INTEGRITY,5,mp4,video harper responding sounds,Demonstrates healthy bonding and cognitive development under father's care,Original - Video,26
A-3,Photo of child's first smile during playtime with father,2024-12-20,INTEGRITY,4,jpg,photo harper smiling mobile,Supports emotional well-being and developmental progress in father's home,Original - Photo,26
A-4,Legal custody documents served to father by Emma's father,2024-12-27,PERJURY,10,pdf,pdf custody papers served,Suspected fraudulent/fake court documents used to manipulate custody,Copy,26
A-5,Medical record confirming infant's weight and health progress,2024-12-17,INTEGRITY,7,pdf,medical record weight checkup,Proof of child's physical growth and father's compliance with medical care,Original - Government Record,26
A-6,Text message evidence of Emma's drug transactions with Tony Baker,Unknown,SAFETY,10,png,screenshot drug transactions emma,Direct evidence of illegal substance use impacting child safety,Original - Screenshot,26
A-7,Police incident record - escorting Craig following conflict,2024-08-05,SAFETY,9,pdf,police report august incident,Establishes history of domestic instability and police intervention,Original - Government Record,26
A-8,Police record - conflict mediation where Craig was advised to walk,2024-09-10,SAFETY,7,pdf,police log september conflict,Documentation of recurrent domestic disputes requiring police presence,Original - Government Record,26
A-9,Photo of Craig's black eye caused by Emma punching him,2024-11-19,SAFETY,9,jpg,photo black eye domestic violence,Evidence of physical assault by applicant against respondent,Original - Photo,26
A-10,Handwritten statement by Emma alleging Craig is abusive/narcissistic,Unknown,PERJURY,10,jpg,handwritten affidavit emma allegations,Subject of contested veracity; potentially defamatory or perjurous content,Original - Handwritten,26
A-11,Notice of First Court Appearance with incorrect year (January 2024),2024-12-17,PERJURY,10,jpg,notice court appearance wrong date,Key evidence of document tampering or bad faith legal maneuvering,Copy,26
A-1,Police Record - Assault Charge regarding incident where father punched son,2012-01-01,SAFETY,10,pdf,police assault charge father son rcmp,Proves physical violence leading to sole custody order,Original - Government Record,27
A-2,Psychological Assessment of Father (ADHD and Asperger’s diagnosis),2012-03-01,SAFETY,9,pdf,psychological assessment adhd aspergers father,Determined risk of volatility and parenting incapacity,Original,27
A-3,Court-to-Court Judicial Communication Protocol - Appendix A in Giesbrecht,2013-01-01,COMMUNICATION,5,pdf,judicial communication protocol giesbrecht appendix,Establishes safeguards for resolving jurisdictional custody disputes,Copy - Court Record,27
A-4,T1 General Form - Father's Undisclosed Capital Gain Records,2005-12-31,FINANCIAL,8,pdf,t1 general capital gain stock options tax,Center of dispute regarding retroactive child support calculation,Copy - Tax Record,27
A-5,Employee Stock Option Exercise Records ($1.38M Gain),2005-01-01,FINANCIAL,7,pdf,stock option exercise capital gain mcneil,Evidence of non-recurring income impacting child support,Original - Corporate Record,27
A-6,Psychologist Court-Ordered Report (Mental Health Opinion),2013-01-01,INTEGRITY,8,pdf,psychologist report mental health expert opinion,Admissibility of non-psychiatrist expert testimony in guardianship,Original,27
A-7,Home Study Report - Clinical Social Worker (Children's Preferences),2012-01-01,COMMUNICATION,6,pdf,home study social worker relocation wishes,Evidenced children's preference in mobility/relocation case,Original,27
A-8,Tax-Free Living Allowance Receipts (Fort McMurray),2014-01-01,FINANCIAL,4,jpg,living allowance receipts fort mcmurray calver,Determined if subsistence allowance should be imputed as income,Screenshot/Scan,27
A-9,Father's Lifestyle Evidence - Tropical Vacation and Orthodontic Receipts,2014-01-01,INTEGRITY,7,pdf,lifestyle expenditures vacation orthodontic receipts,Used to impute income based on expenditures vs reported tax income,Original - Receipts,27
A-10,Policy 713 - Sexual Orientation and Gender Identity (Revised),2023-06-08,INTEGRITY,9,pdf,policy 713 gender identity education nb,Governing policy regarding student name changes and parental consent,Original - Government Policy,28
A-1,Police Email - Assault Charge Confirmation,2025-09-26,PERJURY,10,pdf,police email assault charge,Proves criminal charge against applicant,Original - Government Record,29
A-2,Text message from Emma Ryan admitting to hitting Craig Schulz,2024-11-21,PERJURY,10,jpg,text sorry hitting admission screenshot,Direct admission of perpetrating violence; rebuts abuse claims,Original - Screenshot,29
A-3,Police Email - Verification of Criminal Assault Charge Against Emma Ryan,2025-09-25,SAFETY,10,pdf,police email assault charge confirmation,Corroborates criminal assault charge against applicant for the Dec 9 incident,Copy,29
A-4,Photograph documenting severe diaper rash neglected in Emma's care and its healing,Unknown,SAFETY,8,jpg,photo diaper rash healing documentation,Evidence of child neglect while in mother's care,Original - Photo,29
A-7,Communications related to Emma's delay in retrieving Harper after the Dec 9 incident,2024-12-09,COMMUNICATION,7,pdf,december communication retrieval delay,Proves mother delayed retrieval due to fear of drug testing,Copy,29
A-8,Selfie with courthouse clock/locked door showing sheriff closed five minutes early,2025-11-07,OBSTRUCTION,8,jpg,selfie courthouse clock locked door obstruction,Proof of institutional obstruction preventing deadline compliance,Original - Photo,29
A-10,Screenshot of 'Two Roofs One Home' co-parenting application concept,Unknown,COMMUNICATION,5,png,two roofs one home app screenshot,Demonstrates respondent's proactive efforts toward structured co-parenting,Original - Screenshot,29
A-18,"Video summary of December 9, 2024 assault by Emma Ryan",2024-12-09,SAFETY,10,mp4,video summary assault emma,"Visual evidence of applicant's aggression, object throwing, and violence",Original - Video,29
A-19,Craig Schulz's driving history and conviction record,Unknown,INTEGRITY,6,pdf,craig schulz driving history conviction record,Demonstrates transparency regarding 2019 DUI,Original - Government Record,29
A-20,Documentation related to Craig Schulz's past gambling and business failure,2021-01-01,INTEGRITY,5,pdf,gambling business failure documentation,Proactive disclosure to maintain candor with the court,Copy,29
A-21,Affidavit from local gas station owner Mentorship/Character Reference,Unknown,INTEGRITY,6,pdf,character reference affidavit gas station owner,Independent verification of respondent's personal transformation,Original - Sworn Affidavit,29
A-22,Financial screenshots showing e-transfers to known drug dealer Tony Baker,Unknown,FINANCIAL,10,jpg,etransfer screenshots drug dealer tony baker,Direct financial proof of diversion of family funds to illicit substances,Original - Screenshot,29
A-87,Affidavit of Dale Campbell stating commitment as backup guardian,2025-11-07,FINANCIAL,9,pdf,dale campbell affidavit backup guardian,Proves financial stability ($100k savings) and emergency support plan,Original - Sworn Affidavit,29
A-1,Police Email - Confirmation of Emma Ryan's arrest by RCMP in relation to domestic assault (File 25-2390069).,2025-09-26,SAFETY,10,pdf,police email emma ryan arrest domestic assault,Verifies criminal charges resulting from conduct depicted in video evidence.,Original - Government Record,30
A-2,"Text message screenshot - Emma Ryan admitting to hitting Craig Schulz: ""I'm really sorry for hitting you Craig.""",2024-11-22,PERJURY,10,jpg,text sorry hitting emma craig admission,Direct admission of family violence; refutes applicant's sworn statements.,Original - Screenshot,30
A-3,Medical Review Officer's Report - Craig Schulz comprehensive drug test reporting negative results for all substances.,2025-01-30,INTEGRITY,9,pdf,craig schulz negative drug test mro,Refutes allegations of drug use and demonstrates fitness as a parent.,Original - Government Record,30
A-4,Photograph - Severe diaper rash on Harper Ryan discovered on the night of emergency removal.,2024-12-09,SAFETY,10,jpg,harper diaper rash neglect medical,Direct photographic evidence of medical neglect and poor childcare standards.,Original,30
A-5,Text message screenshot - Emma Ryan admitting to methamphetamine exposure to Harper via breastmilk.,2024-11-30,SAFETY,10,jpg,meth breastmilk admission emma harper,Establishes urgent need for protective orders due to direct drug exposure to infant.,Original - Screenshot,30
A-6,Photograph - Emma Ryan holding and cleaning a methamphetamine pipe.,2025-05-22,SAFETY,10,jpg,emma meth pipe cleaning active drug use,Contemporaneous evidence of active substance abuse during custody period.,Original,30
A-7,"Medical Review Officer's Report - Emma Ryan drug test flagged as ""Negative Dilute.""",2025-01-06,INTEGRITY,8,pdf,emma ryan negative dilute drug test,Suggests potential masking of drug use; reliability of result is legally questionable.,Original - Government Record,30
A-8,"Facebook Messenger Log - Jane Ryan stating ""if you want to see the baby you can take me to court,"" refusing access.",2025-10-19,OBSTRUCTION,9,pdf,jane ryan contempt take me to court access denial,Documented contempt of the October 6 Interim Order by Applicant's agent.,Original - Transcript,30
A-9,Financial Records - PLATINUM ROOFING INC. e-Transfer deposits to Emma Ryan totaling thousands of dollars.,2024-07-01,FINANCIAL,7,jpg,platinum roofing deposits emma ryan support,Proves financial support and refutes claims of abandonment.,Original,30
A-10,Text message log - Social Worker Jacklyn denying conflict of interest despite Facebook friendship with Emma's brother.,2024-09-01,INTEGRITY,9,jpg,jacklyn social worker conflict interest disclosure,Evidence of professional misconduct and bias in child protection assessment.,Original - Screenshot,30
A-11,"Facebook Messenger Log - Emma Elizabeth stating she will ""never ever take her from you.""",2024-11-20,COMMUNICATION,6,jpg,emma never take baby from you text,Contradicted by subsequent 129-day access denial; proves lack of credibility.,Original - Screenshot,30
A-12,Photograph - Mirror in apartment showing meticulous health and diaper logs created by Craig Schulz.,2024-11-17,INTEGRITY,7,jpg,mirror health log harper meticulous care,Documents high standard of care and commitment by the respondent.,Original,30
A-1,"Police Confirmation of Arrest (Sept 26, 2025). Documents official police record of arrest related to domestic assault charge.",2025-09-26,SAFETY,10,pdf,police arrest confirmation assault,Proves criminal arrest of applicant for domestic violence,Original - Official Record,31
A-2,"Text Admission of Violence (Dec 27, 2024). Text message where applicant admits to physical or verbal violence.",2024-12-27,PERJURY,10,jpg,text admission violence screenshot,Direct admission of violence contradicting later filings,Screenshot,31
A-3,"Admission of Meth Use During Pregnancy (Dec 10, 2024). Text confirmation of drug use while pregnant.",2024-12-10,SAFETY,8,jpg,meth use pregnancy admission text,Proves substance abuse endangerment of child,Screenshot,31
A-4,"Photograph of Severe Diaper Rash (Dec 9, 2024). Shows physical signs of medical neglect.",2024-12-09,SAFETY,9,jpg,diaper rash neglect photo,Evidence of medical neglect and lack of child care,Original Photo,31
A-5,"Medical Report - Drug Test: Negative Dilute (Jan 6, 2025). Indicates a likely attempted drug test evasion.",2025-01-06,INTEGRITY,8,pdf,drug test negative dilute report,Suggests concealment of ongoing substance abuse,Copy - Medical Report,31
A-6,"Photograph of Meth Pipe & Propane Torch (May 22, 2025). Shows active drug paraphernalia in child's environment.",2025-05-22,SAFETY,9,jpg,meth pipe torch drug photo,Proves ongoing substance abuse and dangerous environment,Original Photo,31
A-7,"Interim Parenting Order (Oct 6, 2025). Official court order detailing parenting access and supervisor roles.",2025-10-06,COMMUNICATION,7,pdf,interim parenting order maude,Foundational order used to track contempt and access,Court Record,31
A-8,"Email: Access Denial (June 18, 2025). Email from applicant explicitly denying court-ordered access.",2025-06-18,OBSTRUCTION,10,pdf,email access denial obstruction,Direct evidence of intentional contempt of court,Original - Email Copy,31
A-9,"Jane Ryan Contempt Admission (Oct 22, 2025). Audio/Transcript admission of role in access denial.",2025-10-22,OBSTRUCTION,10,pdf,jane ryan contempt admission,Proves third-party 'architect' of access denial,Transcript,31
A-10,E-Transfers to Drug Supplier (Multiple). Financial records showing payments for illegal substances.,Unknown,FINANCIAL,8,pdf,etransfer drug supplier payment,Financial proof of procurement of controlled substances,Bank Record,31
A-11,"Admission of Meth in Breastmilk (Nov 30, 2024). Text admission of drug use while nursing Harper.",2024-11-30,SAFETY,10,jpg,meth breastmilk admission text,Critical endangerment evidence involving direct child harm,Screenshot,31
A-13,"Contradicting Kidnapping Claim (Dec 9, 2024). Evidence disproving applicant's false kidnapping narrative.",2024-12-09,PERJURY,8,jpg,kidnapping claim contradiction text,Undermines applicant credibility regarding emergency filing,Screenshot,31
A-14,"Medical Records Request (Feb 13, 2025). Proactive request for child's health history by respondent.",2025-02-13,INTEGRITY,5,pdf,medical records request harper,Demonstrates fitness and proactive parenting focus,Original Email,31
A-16,"Health Tracking Log Photo (Nov 17, 2024). Record of newborn health maintenance by respondent.",2024-11-17,INTEGRITY,5,jpg,health tracking log newborn,Proves superior caregiving capability by respondent,Photograph of Log,31
A-17,Character Reference - Ex-Partner (Jan 2025). Statement confirming respondent's stable long-term history.,2025-01-01,INTEGRITY,8,jpg,character reference ex partner,Refutes allegations of long-term violence/instability,Screenshot,31
A-22,Contempt Log - 18 Denied Sundays (129+ Days). Detailed record of all access violations.,Unknown,OBSTRUCTION,10,pdf,contempt log 129 days denial,Mathematical proof of systematic parental alienation,Log Entry,31
A-56,"Respondent's Drug Test: Clean/Negative (Jan 30, 2025). Negative result for all controlled substances.",2025-01-30,INTEGRITY,8,pdf,respondent negative drug test,Proves sobriety and stability of respondent,Official Medical Record,31
A-76,"Respondent's Injury Photographs (Dec 10, 2024). Photos of physical injuries sustained by respondent during domestic incident.",2024-12-10,SAFETY,10,jpg,respondent injury photo assault,Physical proof that respondent was the victim of violence,Original Photo,31
A-79,FaceTime with Unknown Male (Apr 2025). Interaction involving child and unidentified associate of applicant.,2025-04-01,SAFETY,7,jpg,facetime unknown male video,Endangerment and associate risk factors,Screenshot,31
A-84,"Integrity Certification (Nov 5, 2025). Professional certification of file hash and authenticity.",2025-11-05,INTEGRITY,10,pdf,evidence integrity certification,Cryptographic proof that evidence has not been altered,Original System Document,31
A-1,Police Confirmation of Arrest - Email from Constable Benjamin Cannon confirming Emma Ryan's arrest for domestic assault,2025-09-26,SAFETY,10,pdf,police email assault charge,Third-party government confirmation of domestic violence charge against Applicant,Original - Government Record,32
A-2,Text message from Emma Ryan admitting to hitting Craig Schulz,2024-11-21,PERJURY,10,jpg,text apology hitting admission screenshot,Direct admission of physical violence by Applicant; refutes allegations of being the victim,Original - Screenshot,32
A-3,Admission of Methamphetamine use during pregnancy and postpartum in text exchange,2024-12-10,SAFETY,10,jpg,text meth pregnancy admission screenshot,Admits to exposing the child to illicit substances during critical developmental periods,Original - Screenshot,32
A-4,Photograph of severe diaper rash on Harper Ryan while in Applicant's care,2024-12-09,SAFETY,8,jpg,photo diaper rash neglect,Evidence of physical neglect and failure to provide basic hygiene/care,Original - Photograph,32
A-5,Applicant's drug test result reported as 'Negative - Dilute',2025-01-06,INTEGRITY,7,pdf,drug test negative dilute report,Suggests willful evasion or attempt to mask substance use,Original - Medical Record,32
A-6,Photograph of Applicant handling a meth pipe and propane torch in the home,2025-05-22,SAFETY,10,jpg,photo meth pipe torch endangerment,Direct visual evidence of active drug use and extreme fire hazard in child's environment,Original - Photograph,32
A-8,Email from Applicant declaring intent to block parenting time until October court date,2025-06-18,OBSTRUCTION,9,pdf,email access denial intent,Proof of willful and malicious intent to breach court-ordered access,Original - Email,32
