Exhibit Number,Description,Date,Category,Priority,File Type,Keywords,Legal Significance,Status,Source
A-5,Dispute Resolution Decision - Legally-binding decision made by an RTB Arbitrator,Unknown,INTEGRITY,10,pdf,rtb decision arbitrator binding,Final legal determination of a tenancy dispute,Original - Government Record,10
A-6,Writ of Possession - BC Supreme Court document to legally remove a tenant,Unknown,SAFETY,10,pdf,writ possession supreme court eviction,Authorized court order for physical eviction,Original - Government Record,10
A-7,1 Month Notice to End Tenancy - Eviction notice for cause (noise/hoarding),2021-05-07,SAFETY,9,pdf,eviction notice cause noise hoarding,Legal instrument used to attempt termination of tenancy,Copy,10
A-8,Statement of Contributions - Record of CPP earnings and contributions,Unknown,FINANCIAL,8,pdf,cpp statement contributions earnings mqp,Determines eligibility for federal disability benefits based on work history,Original - Government Record,10
A-9,Retainer Agreement - Contract for legal advocacy services,Unknown,COMMUNICATION,5,pdf,retainer agreement advocate client,Defines the scope of legal representation and duty of loyalty,Original,10
A-10,Digital Evidence - Photographs of suite condition after repairs,2021-05-01,INTEGRITY,8,jpg,photos suite condition evidence,Visual proof to counter allegations of property damage or risk,Original,10
A-1,Ontario Court Services Division Annual Report 2008/2009,2009-04-30,FINANCIAL,4,pdf,ontario court services division annual report 2008 2009,Statistical context for family law proceedings in Ontario,Copy,11
A-2,Katelynn Sampson Custody Order - Court File No. F0-07-11277-00,2008-06-06,SAFETY,10,pdf,katelynn sampson custody order transer donna irving,Proves the legal transfer of custody to an abusive caregiver leading to a fatality,Original - Government Record,11
A-3,Short note to the Court from 14-year-old child in T.B.M. v. C.J.M.,2009-01-01,COMMUNICATION,6,jpg,child note speak court confusion tbm cjm,Attempt by child to provide direct evidence to clear up confusion,Original,11
A-4,Police Record - Assault Charges against Donna Irving and Wayne Johnson,2008-08-03,SAFETY,10,pdf,police record assault murder charges katelynn sampson,Proves criminal charges following child safety failure,Copy - Government Record,11
A-5,Ontario Family Mediation Service RFP - Request for Proposals,2011-01-01,INTEGRITY,5,pdf,ontario family mediation service rfp request proposals,Outlines mandatory screening protocols for domestic violence,Copy,11
A-6,Ellen Gesmer's 'Custody Speech' - Judicial Campaign Material,2010-09-28,COMMUNICATION,7,pdf,ellen gesmer custody speech settlement pre trial,Documents the informal judicial settlement mission and its messaging,Screenshot - Campaign Material,11
A-7,Undated note from child to mother's affidavit in E.A. v. D.D.P.,Unknown,COMMUNICATION,3,jpg,undated child note affidavit ea ddp,Evidence of child's voice presented via parent's affidavit,Screenshot,11
A-8,Statistics Canada - Income of Canadians Report,2009-06-03,FINANCIAL,2,pdf,statistics canada income canadians 2007,Used to establish financial barriers to legal representation,Copy,11
A-1,Screenshot showing potential custody related evidence,2025-07-16,COMMUNICATION,5,png,screenshot 20250716 000155,Evidentiary record of interactions related to custody candidate status,Original - Screenshot,12
A-2,Screenshot record for custody dispute,2025-07-15,COMMUNICATION,5,png,screenshot 20250715 012142,Evidence of communication patterns or events for custody case,Original - Screenshot,12
A-3,"Interim Order Ryan v. Schulz - March 24, 2025",2025-03-24,INTEGRITY,8,pdf,fdsj7392024 ryan schulz interim order,Formal court directive governing custody or conduct,Copy - Government Record,12
A-4,Emergency Custody Filing Affidavit - Transcribed,2024-11-12,SAFETY,9,pdf,harperryan 11122024 emerg custody filing transcribed,Transcribed sworn statements regarding child safety and emergency needs,Copy,12
A-5,Emma Assault Charge Email Confirmation,2025-09-25,PERJURY,10,pdf,emma assault charge email confirmation,Proves criminal charge against applicant; critical for fitness assessment,Original,12
A-6,Emma Arrest Email,2025-09-26,SAFETY,10,pdf,92625 emma arrest email,Direct evidence of law enforcement involvement and arrest of party,Original,12
A-7,"Video of Emma Assault - November 30, 2025",2025-11-30,SAFETY,10,mov,video emmaassault 11302025,Visual evidence of physical assault; smoking gun for safety concerns,Original,12
A-8,Harper Rash Record,2024-12-09,SAFETY,7,jpg,harper rash 12092024,Evidence of child's medical condition or neglect,Original,12
A-9,Voluntary Child Support Offer - Craig Schulz,2025-10-08,FINANCIAL,6,docx,voluntary child support offer updated craig schulz,Demonstrates financial responsibility and intent to provide support,Original,12
A-10,Psychological Analysis of Email Behavior,2025-10-03,COMMUNICATION,7,pdf,psychological analysis emma email behavior,Expert or analytical insight into party's mental state/harassment,Copy,12
A-11,Formal Complaint Against Jacqueline Gallant - Conflict of Interest,2025-09-30,INTEGRITY,8,pdf,formal complaint jacqueline gallant conflict interest,Challenges professional integrity/bias in the case process,Original,12
A-12,Emma Punch Video,2024-11-19,SAFETY,10,mp4,emmapunch 111924 video,Direct evidence of physical violence,Original,12
A-13,Emma Update Full Email Archive,2025-09-03,COMMUNICATION,5,pdf,0903emmaupdatefullemail,Comprehensive log of communications regarding case updates,Copy,12
A-14,Statement of Position for Case Conference,2025-10-06,INTEGRITY,7,docx,statement position case conference,Outlines formal legal stance and demands of the respondent,Original,12
A-15,Urgent Medical History and Substance Exposure Info,2025-06-19,SAFETY,9,pdf,urgent information harper ryan medical history substance exposure,Critical health information regarding prenatal/postnatal child risks,Original,12
A-1,Text message acknowledging debt,2016-06-02,COMMUNICATION,10,jpg,text message debt acknowledgement,Resets the limitation period for the claim under section 13 of the Limitations Act.,Original - Digital Signature,13
A-2,Record of non-consummation based on religious belief,2021-11-10,INTEGRITY,8,pdf,annulment religious belief non-consummation,Establishes psychological incapacity for marriage annulment based on sincere religious norms.,Original,13
A-3,Mother's withholding of children's health cards and ID,2021-10-28,SAFETY,7,pdf,health card withholding vaccination,Evidence of mother's obstruction regarding child's best interests for medical treatment.,Original,13
A-4,Intimate and private photographs posted online without consent,2016-12-31,SAFETY,10,jpg,private photographs online harassment,Basis for the newly recognized tort of public disclosure of private information.,Screenshot - Digital Record,13
A-5,With prejudice settlement offer regarding children's return to Dubai,2020-11-01,COMMUNICATION,9,pdf,settlement offer dubai child return,Terms included in a section 40 order for child return in abduction cases.,Original,13
A-6,RCMP investigation report on sexual abuse allegations,2021-02-11,PERJURY,10,pdf,rcmp investigation false allegations,Proves the mother made false allegations to obstruct parenting time.,Original - Police Record,13
A-7,Marriage Contract signed with Independent Legal Advice,2016-01-01,FINANCIAL,9,pdf,marriage contract disclosure,Excludes the matrimonial home from equalization; upheld despite disclosure challenges.,Original,13
A-8,Financial Statements for high income support calculation,2021-02-01,FINANCIAL,8,pdf,financial statement high income support,Used to calculate spousal support based on $1.8 million annual income.,Original,13
A-9,Zoom trial audio of unidentified male regarding 'soft' drugs,2021-02-01,SAFETY,6,mp4,zoom audio drugs recording,Raised concerns of drug involvement and witness influence; led to mistrial motion.,Digital Recording,13
A-10,Corporate search for 2782708 Ontario Inc.,2020-12-03,INTEGRITY,9,pdf,corporate search ownership fraud,Revealed parents of the wife were the secret purchasers of the matrimonial home.,Original - Government Record,13
A-1,Photograph of black eye sustained by Craig Schulz due to alleged assault by Emma Ryan.,2024-11-19,SAFETY,10,jpg,black eye photo assault injury,Direct physical evidence of domestic violence by the applicant against the respondent.,Original - Digital Photo,"14, 15"
A-2,"Text message admission from Emma Ryan: ""I'm really sorry for hitting you, Craig. I just don't know what else to do when I get that angry.""",2024-11-21,PERJURY,10,jpg,text sorry hitting admission screenshot,Direct written admission of physical violence; refutes applicant's claims of being the victim.,Screenshot - Cryptographically Verified,14
A-3,Text message screenshot where Emma Ryan admits to methamphetamine exposure to infant via breast milk.,2024-12-10,SAFETY,10,jpg,text meth exposure breast milk,Proves immediate child endangerment and medical negligence regarding infant's safety.,Screenshot,14
A-4,Photograph of infant Harper with severe medically significant diaper rash.,2024-12-09,SAFETY,8,jpg,diaper rash neglect photo,Evidence of physical neglect occurring while child was in the mother's care.,Original - Digital Photo,14
A-5,Drug test report for Emma Ryan showing a 'negative dilute' result.,2025-01-06,OBSTRUCTION,9,pdf,drug test negative dilute report,Indicates probable evasion or masking of substance use; judicially suspicious result.,Copy - Medical Record,14
A-6,Video/Screenshot allegedly showing Emma Ryan cleaning a meth/crack pipe in the maternal home near the child.,2025-05-22,SAFETY,10,jpg,meth pipe cleaning paraphernalia,Evidence of drug paraphernalia in the infant's immediate care environment.,Original - Video Frame,14
A-7,Interim Parenting Order granting specific Sunday parenting time to Craig Schulz.,2025-10-06,COMMUNICATION,7,pdf,interim order parenting schedule,Established binding legal access rights; basis for contempt motion.,Original - Court Record,14
A-8,"Email from Emma Ryan stating ""Won't see Harper until we see a judge in October.""",2025-06-18,OBSTRUCTION,10,pdf,email access refusal judge october,Proof of willful intent to defy a court order and deny access.,Screenshot/Copy,"14, 15"
A-9,"Text message from Jane Ryan stating ""If you want to see Harper, you can take me to court yourself.""",2025-10-22,OBSTRUCTION,10,jpg,jane ryan text take me to court,Evidence of third-party interference and willful contempt by the maternal grandmother.,Screenshot,14
A-10,Financial records showing e-transfers from Emma Ryan to alleged drug supplier Tony Baker.,Unknown,FINANCIAL,9,pdf,etransfer financial drug dealer records,Links financial resource diversion directly to alleged substance abuse pattern.,Copy - Bank Record,14
A-11,Video Index documenting Emma Ryan throwing objects and hitting baby gate/child.,2024-12-09,SAFETY,10,mp4,video assault frying pan gate,Direct visual evidence of violent behavioral escalation and danger to the infant.,Original - Video Record,"14, 15"
A-12,Formal complaint against DSD social worker Jaclyn Galant filed with NBSW.,2025-02-10,INTEGRITY,8,pdf,nbasw complaint social worker galant,Documents institutional failure and alleged conflict of interest in safety assessment.,Original - Professional Filing,14
A-13,Communication log showing 129 consecutive days of access denial and 18 missed Sunday visits.,2025-10-10,OBSTRUCTION,10,pdf,denial log access 129 days,Quantitative proof of systematic parental alienation and breach of court orders.,Original - Litigation Log,14
A-14,Email bounce-back notifications from Emma Ryan's accounts on infant's 1st birthday.,2025-11-12,COMMUNICATION,8,jpg,birthday email bounce full mailbox,Proves willful communication blockage and malicious alienation on significant milestone.,Screenshot - Server Error,"14, 16"
A-15,Photograph of Emma Ryan holding a meth pipe and a propane torch simultaneously.,2025-05-22,SAFETY,10,jpg,meth pipe propane torch photo,Evidence of extreme fire hazard and active drug use in child's presence.,Original - Digital Photo,14
A-1,"Police Confirmation of Applicant's criminal assault charge regarding Dec 9, 2024 incident",2025-09-26,SAFETY,10,pdf,police confirmation assault charge emma ryan,Proves criminal charge against applicant for family violence,Original - Government Record,17
A-2,Text Message Admission - Emma Ryan apologizing for hitting Craig Schulz,2024-11-21,PERJURY,10,jpg,text admission emma hitting craig screenshot,Direct admission of physical assault; refutes applicant's claims of being the victim,Original - Screenshot,17
A-3,Admission of Methamphetamine use during pregnancy,Unknown,SAFETY,10,pdf,methamphetamine use pregnancy admission,Proves profound risk to infant safety and neurological health,Original,17
A-4,Photographic evidence of severe diaper rash on infant Harper,2024-12-09,SAFETY,8,jpg,harper diaper rash neglect photo,Documents physical neglect while in the applicant's care,Original - Photo,17
A-5,Applicant's drug test result showing 'Negative - Dilute',2025-01-29,INTEGRITY,9,pdf,drug test negative dilute emma ryan,Suggests willful evasion or masking of substance use; major legal red flag,Copy - Lab Report,17
A-6,Video evidence of Applicant cleaning a meth pipe and torch,Unknown,SAFETY,10,mp4,video meth pipe cleaning emma,Direct visual evidence of illegal substance activity in home,Original - Video,17
A-8,Email from Applicant declaring intention to block total access to Harper,Unknown,OBSTRUCTION,9,pdf,email block access harper emma ryan,Direct proof of willful intent to deny court-ordered access and alienation,Original - Email,17
A-9,Call records/transcripts where Jane Ryan admits to and enforces denial of access,Unknown,OBSTRUCTION,8,pdf,jane ryan call transcript denial access,Proof of third-party willful obstruction and alienation campaign,Original - Transcript,17
A-10,Financial records of e-transfers to alleged drug supplier,Unknown,FINANCIAL,9,pdf,etransfer drug supplier financial records,Establishes pattern of procurement and diversion of funds for drugs,Copy - Bank Record,17
A-11,Acknowledgment of methamphetamine in breastmilk by Applicant,Unknown,SAFETY,10,jpg,meth breastmilk acknowledgment text,Proves immediate physical endangerment of the infant,Original - Screenshot,17
A-22,Detailed chronological contempt log tracking 18+ denied Sunday visits,2025-06-04,OBSTRUCTION,10,pdf,contempt log denied visits access,Mathematical proof of systematic violation of interim court order,Original - Spreadsheet,17
A-32,Photograph of Applicant with propane torch and meth pipe,2025-05-22,SAFETY,10,jpg,emma ryan torch meth pipe photo,Direct visual evidence of active substance abuse postpartum,Original - Photo,17
A-56,Respondent's (Craig Schulz) negative drug test result,2025-01-31,INTEGRITY,7,pdf,craig schulz drug test negative,Establishes respondent's sobriety and counters allegations of unfitness,Copy - Lab Report,17
A-64,Jointly signed parenting plan document subsequently ignored by Applicant,2025-01-22,INTEGRITY,8,pdf,signed parenting plan agreement jan 22,Shows bad faith/deception in stalling legal filings,Copy - Signed Document,17
A-79,Applicant's Official 2024 Notice of Assessment (NOA),2025-11-01,FINANCIAL,6,pdf,noa 2024 applicant financial accountability,Verified income and financial integrity documentation,Copy - Government Record,17
A-1,AI Version of events transcribed video - 12092024,2024-12-09,COMMUNICATION,8,png,ai version events transcribed video 12092024,Transcription of visual evidence regarding custody events,Screenshot,18
A-2,Craig's Identification,2025-09-03,INTEGRITY,5,png,craigs identification,Verification of party identity,Original,18
A-3,Dad's Negative Drug Screen,2025-09-03,SAFETY,9,png,dads negative drug screen,Proves sobriety and fitness of parent,Copy,18
A-4,Emma Affidavit Pages 1-2 of 17,2025-09-03,PERJURY,7,png,emma affidavit pages 1 2 of 17,Sworn statement regarding case facts,Original,18
A-5,Emma Apology Text 11222024,2024-11-22,COMMUNICATION,10,png,emma apology text 11222024,Admission against interest; apology for past behavior,Screenshot,18
A-6,Emma Drug Screen Negative Dilute,2025-09-03,SAFETY,8,png,emma drug screen negative dilute,Parental safety check; dilute result suggests potential tampering,Copy,18
A-7,Emma Financial Example - Craig's pay being deposited,2025-09-03,FINANCIAL,7,png,emma financial example craigs pay deposited,Evidence of financial commingling or control,Original,18
A-8,Emma Meth Pipe 052425,2025-05-24,SAFETY,10,png,emma meth pipe 052425,Direct evidence of illegal drug paraphernalia and endangerment,Original,18
A-9,Harper Bum Rash 12092024,2024-12-09,SAFETY,9,png,harper bum rash 12092024,Evidence of medical neglect or hygiene issues,Original,18
A-10,March 24 Court Conference,2025-09-03,INTEGRITY,6,png,march 24 court conference,Record of prior court proceedings,Original,18
A-11,Tony Emma 12082024 Drugs,2024-12-08,SAFETY,9,png,tony emma 12082024 drugs,Evidence linking individuals to drug use,Screenshot,18
A-12,Gmail - Fwd: Subject Important Medical Information for Harper Ryan - Prenatal/Postnatal History,2025-06-22,COMMUNICATION,8,pdf,gmail medical information harper ryan prenatal postnatal history,Critical medical history and exposure history of the minor child,Copy,18
A-13,Video 2025-01-08.MP4,2025-01-08,SAFETY,10,mp4,20250108 mp4,Visual evidence of conduct affecting custody,Original,18
A-14,Emma email June 26th pickup confirmation,2025-06-28,COMMUNICATION,5,png,emma email june 26th pickup,Coordination of child transfer and compliance with schedule,Screenshot,18
A-15,Emma's reply to Christmas proposal,2025-07-02,COMMUNICATION,4,html,emmas reply christmas proposal,Evidence of negotiation regarding holiday parenting time,Original,18
A-16,Emma Nick St Pierre 0524 Photoshop Analysis,2025-06-30,PERJURY,9,pdf,emma nick st pierre 0524 photoshop,Proves alteration of evidence by the other party,Original,18
A-1,"Police Records - Documentation of domestic abuse, substance abuse, or safety concerns",Unknown,SAFETY,9,pdf,police record arrest domestic abuse safety,Proves history of violence or legal safety concerns which influence custody decisions.,Original - Government Record,19
A-2,Electronic Breathalyzer Results - Concrete data on alcohol consumption levels,Unknown,INTEGRITY,10,pdf,bactrack breathalyzer test result sobriety,Concrete electronic evidence used to refute or prove Substance Use Disorder claims.,Original - Electronic Record,19
A-3,Employment and School Records - Third-party proof of parental stability and responsibility,Unknown,INTEGRITY,8,pdf,employment school records stability attendance,Demonstrates stability of the parent's lifestyle and caregiving capability.,Original,19
A-4,Bank Records - patterns of spending related to substance use or financial responsibility,Unknown,FINANCIAL,7,pdf,bank statement spending patterns substance use,Used to establish irresponsible financial habits or evidence of substance abuse behaviors.,Copy,19
A-5,"Medical Records - Documentation of health issues, disabilities, or Substance Use Disorder",Unknown,SAFETY,9,pdf,medical records health diagnosis sud,Essential for proving physical or emotional conditions affecting parenting ability.,Original,19
A-6,Social Media Screenshots - Posts demonstrating disregard of custody terms or disparagement,Unknown,COMMUNICATION,6,png,social media screenshot post disparagement,Evidence of one parent disparaging the other or violating restraining orders.,Screenshot,19
A-7,"Personal Communications - Texts, emails, or letters relevant to parenting behavior",Unknown,COMMUNICATION,8,pdf,texts emails letters communication behavior,Shows interaction patterns and potential behavioral issues relevant to the child's interests.,Copy/Screenshot,19
A-8,Social Services Reports - Investigations into child welfare ordered by the court,Unknown,SAFETY,10,pdf,social services report welfare investigation,Critical independent assessment of the child's welfare and home environment.,Original - Government Record,19
A-9,Private Investigator Reports - Refutation or confirmation of claims made by the opposing party,Unknown,INTEGRITY,7,pdf,pi report investigator evidence search,Assists in refuting fabrications or proving hidden behaviors of the other party.,Original,19
A-10,Witness Statements - Testimony from neighbors or third parties regarding daily parenting life,Unknown,INTEGRITY,5,pdf,witness statement testimony parenting ability,Provides anecdotal evidence of how a parent's health or behavior affects daily life.,Original,19
A-11,Affidavit of Parental Preference - Expressed wishes of children over 10 or 12 years old,Unknown,INTEGRITY,9,pdf,child wishes affidavit preference,Statutory consideration given to the desires of the child in custody determinations.,Original,19
A-12,Evidence of Unilateral Action - Proof of parent moving first and asking permission later,Unknown,OBSTRUCTION,7,pdf,unilateral action move relocation evidence,"Evidence of bad conduct/obstruction, though not always determinative of the outcome.",Original,20
A-1,Court Ruling - Re Hardy (1979) - Opinion on third bankruptcy being excessive,1979-01-01,INTEGRITY,7,pdf,re hardy court ruling bankruptcy integrity,"Establishes judicial view that a third bankruptcy is one too many, testing the integrity of the process.",Copy,21
A-2,Court Ruling - Re Resnick (1990) - Observation on cycle of repeat bankruptcies,1990-01-01,INTEGRITY,6,pdf,re resnick court ruling repeat bankruptcy,Notes that multiple discharges may simply prepare the way for subsequent filings.,Copy,21
A-3,Court Case - Rogers (Trustee of) v. Canada (AG) - Refusal of fifth discharge due to tax arrears pattern,1989-01-01,FINANCIAL,9,pdf,rogers trustee canada ag fifth bankruptcy tax,Demonstrates court's power to refuse discharge for habitual bankrupts using the system for tax evasion.,Copy,21
A-4,OSB Statistical Report BKHQRA-2157 - Breakdown of repeat bankruptcies (2010-2012),2013-03-28,FINANCIAL,5,pdf,osb report bkhqra2157 repeat bankruptcy statistics,Provides empirical evidence of the growth and frequency of repeat filings in the Canadian system.,Original,21
A-5,Court Ruling - Re Pitre (2009) - Priority of system integrity over rehabilitation,2009-01-01,INTEGRITY,8,pdf,re pitre court ruling integrity vs rehabilitation,Upholds that system integrity overrides debtor rehabilitation in multiple bankruptcy cases.,Copy,21
A-6,Court Ruling - Re Willier (2005) - Test for concept of debtor recidivism,2005-01-01,INTEGRITY,7,pdf,re willier court ruling debtor recidivism,Identifies a third-time bankrupt as an example of economic recidivism requiring societal protection.,Copy,21
A-7,Court Ruling - Bank of Montreal v. Giannotti - Definitions of rehabilitation for honest debtors,2000-01-01,INTEGRITY,6,pdf,bank of montreal v giannotti court case,Clarifies that the fresh start is intended for honest and unfortunate debtors.,Copy,21
A-8,Court Ruling - Re Tang (2007) - Refusal of second discharge due to reckless behavior,2007-01-01,INTEGRITY,8,pdf,re tang court ruling reckless bankruptcy,Example of denial of discharge when a repeat filing is caused by non-rehabilitated behavior.,Copy,21
A-9,Court Ruling - Re Martens (1994) - Critique of the BIA used as a 'convenient ink remover' for taxes,1994-01-01,FINANCIAL,7,pdf,re martens tax driven bankruptcy ruling,Addresses misuse of BIA to avoid legitimate tax liabilities across multiple filings.,Copy,21
A-10,Evaluation of Mandatory Counselling Report - Audit and Evaluation Branch (2013),2013-01-01,COMMUNICATION,4,pdf,aeb report mandatory counselling evaluation 2013,Assesses whether statutory counselling is meeting its goal of reducing repeat filings.,Original,21
A-11,Court Ruling - Re Garness (2004) - Comparison of bankrupt to 'SARS-like presence',2004-01-01,INTEGRITY,8,pdf,re garness economic quarantine ruling,Emphasizes the need to protect the economic community from highly irresponsible repeat filers.,Copy,21
A-12,Court Ruling - Re Hiebert (2008) - Denial of fourth discharge for lack of insight,2008-01-01,INTEGRITY,9,pdf,re hiebert fourth bankruptcy discharge denial,Sets precedent for refusing discharge when no changes in financial management are demonstrated by the fourth filing.,Copy,21
A-1,Evidence of child freezing incident involving failure to provide heat or protection from elements,2025-01-04,SAFETY,10,pdf,january 4 freezing child neglect incident,Paramount safety issue that outweighs procedural delay under Rule 3.02 (NB) or Variation (NS),Original,22
A-2,Late-filed affidavit regarding child endangerment,Unknown,SAFETY,8,pdf,late affidavit child safety NBKB,Reframes prejudice to prioritize the child's welfare over administrative deadlines,Copy,22
A-3,Campaign of denigration fueled by false allegations of abuse,Unknown,PERJURY,9,pdf,doncaster field campaign denigration allegations,Demonstrates litigation abuse and can lead to a reversal of primary care,Original - Court Record,22
A-4,Documented patterns of intimate terrorism and systemic control,2023-01-01,SAFETY,9,pdf,nova scotia mass casualty commission IT pattern,Identifies the primary aggressor in family violence contexts,Original - Public Record,22
A-5,Evidence of grandmother serving as a 'Shadow Applicant' orchestrating alienation,Unknown,OBSTRUCTION,7,pdf,simmons grandmother shadow applicant gatekeeping,Justifies restrictive orders or supervision to preserve parent-child bond,Original,22
A-6,Fabricated reports of child abuse used for tactical litigation advantage,Unknown,PERJURY,10,pdf,fabricated abuse report litigation harassment,Recognized as a form of family violence and misuse of court process,Original,22
A-1,Text message from December 8th saying 'leave it in the mailbox so Craig doesn't flip out',Unknown-12-08,COMMUNICATION,7,png,text message mailbox craig flip out,"Evidence of secrecy, lack of cooperation, and manipulative behavior detrimental to stable co-parenting under Section 50(2)(c).",Screenshot,23
